{
  "schema": "pweh.case/v1",
  "id": "example-hikvision-sample",
  "title": "hikvision-like 합성 IP 카메라 — UART 덤프와 인증 우회 패턴 탐색 예제",
  "status": "open",
  "created_at": "2026-10-18T17:39:06.725Z",
  "updated_at": "2026-10-18T17:40:22.992Z",
  "profile": "hikvision-ipc",
  "target": {
    "vendor": "pweh-synthetic (hikvision-like, 실제 벤더 아님)",
    "model": "SYNTH-HIK-IPC",
    "hardware_rev": "sim-1",
    "firmware_version": "synthetic-2020-03-23",
    "serial": "SIM-HIK-0001",
    "soc": "hi3516ev300 (U-Boot env soc)",
    "flash": "W25Q128(B/F)V spi-nor 16 MiB",
    "uboot_version": "U-Boot 2016.11 (Mar 23 2020 - 14:58:03 +0800)hi3516ev300",
    "kernel_version": "4.9.37"
  },
  "authorization": {
    "basis": "owned",
    "owner": "PWEH 테스트 랩 (합성 시나리오)",
    "statement": "이 카메라는 제가 직접 구매한 제 소유 기기이며, 하드웨어 보안 분석을 허가합니다. (합성 시나리오: pweh.mocktarget 시뮬레이터)",
    "scope": "UART 콘솔 접속, 플래시 읽기 전용 덤프, 펌웨어 정적 분석. 영구 변경 금지.",
    "document_ref": null,
    "attested_by": "user (relayed by agent)",
    "attested_via": "agent-relayed",
    "attested_at": "2026-10-18T17:39:06.725Z"
  },
  "phases": {
    "uart-shell-acquisition": {
      "status": "done",
      "updated_at": "2026-10-18T17:39:10.464Z"
    },
    "firmware-dump-via-uart": {
      "status": "done",
      "updated_at": "2026-10-18T17:39:51.082Z"
    },
    "logic-analyzer-protocol-decode": {
      "status": "pending"
    },
    "firmware-static-analysis": {
      "status": "done",
      "updated_at": "2026-10-18T17:40:09.379Z"
    },
    "cctv-auth-bypass-hunt": {
      "status": "partial",
      "updated_at": "2026-10-18T17:40:22.968Z"
    },
    "report": {
      "status": "done",
      "updated_at": "2026-10-18T17:40:22.982Z"
    }
  },
  "artifacts": [
    {
      "path": "uart/console-001.log",
      "kind": "uart-log",
      "producer": "uart-mcp",
      "is_dir": false,
      "created_at": "2026-10-18T17:39:50.962Z",
      "description": "UART 세션 console-001 (/dev/pts/8 @ 115200 8N1) — 텍스트 로그(RX/TX)",
      "size": 113762944,
      "sha256": "36035c654bd63c6cd448421179ca1f04f5859d0ce6c7b01fb098ef8e9c713966",
      "extra": {
        "session_id": "console-001",
        "port": "/dev/pts/8",
        "baudrate": 115200
      },
      "id": "A-0001"
    },
    {
      "path": "uart/console-001.raw",
      "kind": "uart-raw",
      "producer": "uart-mcp",
      "is_dir": false,
      "created_at": "2026-10-18T17:39:51.028Z",
      "description": "UART 세션 console-001 (/dev/pts/8 @ 115200 8N1) — 수신 원시 바이트",
      "size": 83187263,
      "sha256": "e0228350507254817fa35d3acf4b4cc8ff8ef8d7ccec3bc9a3f9107d8b8e6bdb",
      "extra": {
        "session_id": "console-001",
        "port": "/dev/pts/8",
        "baudrate": 115200
      },
      "id": "A-0002"
    },
    {
      "path": "uart/console-001.events.jsonl",
      "kind": "uart-events",
      "producer": "uart-mcp",
      "is_dir": false,
      "created_at": "2026-10-18T17:39:51.077Z",
      "description": "UART 세션 console-001 (/dev/pts/8 @ 115200 8N1) — 송신·안전 결정·문맥 이벤트",
      "size": 85163,
      "sha256": "015b518d473cbaaf70d34eb2c403ce0fccbcd8454ed27a7dad9af28093c40942",
      "extra": {
        "session_id": "console-001",
        "port": "/dev/pts/8",
        "baudrate": 115200
      },
      "id": "A-0003"
    },
    {
      "path": "uart/console-001-boot-01.log",
      "kind": "uart-log",
      "producer": "uart-mcp",
      "is_dir": false,
      "created_at": "2026-10-18T17:39:09.250Z",
      "description": "부팅 로그 발췌 (console-001, 5900 바이트)",
      "size": 5772,
      "sha256": "9cd810aee5c90660c0f2926e2c74149f8985b83f4be0c6055ad1f8b7a108e968",
      "extra": {
        "session_id": "console-001",
        "type": "boot-capture",
        "cursor_start": 0,
        "cursor_end": 5900
      },
      "id": "A-0004"
    },
    {
      "path": "dumps/probe-kernel-head.bin",
      "kind": "flash-dump",
      "producer": "uart-mcp",
      "is_dir": false,
      "created_at": "2026-10-18T17:39:11.395Z",
      "description": "UART 덤프 (uboot-md, sf)",
      "size": 65536,
      "sha256": "b6f2e962ba93c66ede13e70169701414a72530c57bf0ce4b186d97022dfef230",
      "extra": {
        "metadata": "dumps/probe-kernel-head.json",
        "method": "uboot-md",
        "sha256": "b6f2e962ba93c66ede13e70169701414a72530c57bf0ce4b186d97022dfef230"
      },
      "id": "A-0005"
    },
    {
      "path": "dumps/probe-kernel-head.json",
      "kind": "other",
      "producer": "uart-mcp",
      "is_dir": false,
      "created_at": "2026-10-18T17:39:11.399Z",
      "description": "UART 덤프 메타데이터",
      "size": 1747,
      "sha256": "176ca34fa06fafbe46deb2f8ef468b40553cd5cffabf0cdd153c7557787b6b07",
      "extra": {
        "type": "dump-metadata",
        "dump": "dumps/probe-kernel-head.bin"
      },
      "id": "A-0006"
    },
    {
      "path": "dumps/flash-full.bin",
      "kind": "flash-dump",
      "producer": "uart-mcp",
      "is_dir": false,
      "created_at": "2026-10-18T17:39:50.470Z",
      "description": "UART 덤프 (uboot-md, sf)",
      "size": 16777216,
      "sha256": "e95ae853526947b9d29011f61c4cb3b92ce6fdff8a368cd23eef14cd40c5c2a2",
      "extra": {
        "metadata": "dumps/flash-full.json",
        "method": "uboot-md",
        "sha256": "e95ae853526947b9d29011f61c4cb3b92ce6fdff8a368cd23eef14cd40c5c2a2"
      },
      "id": "A-0007"
    },
    {
      "path": "dumps/flash-full.json",
      "kind": "other",
      "producer": "uart-mcp",
      "is_dir": false,
      "created_at": "2026-10-18T17:39:50.482Z",
      "description": "UART 덤프 메타데이터",
      "size": 12224,
      "sha256": "1689105f5fa59c9e8b21b26a397b822be8dfa1833ae9fd24669ecefce233d7e4",
      "extra": {
        "type": "dump-metadata",
        "dump": "dumps/flash-full.bin"
      },
      "id": "A-0008"
    },
    {
      "path": "analysis/identify-001.json",
      "kind": "triage-report",
      "producer": "fwtriage-mcp",
      "is_dir": false,
      "created_at": "2026-10-18T17:39:50.867Z",
      "description": "fw_identify dumps/flash-full.bin",
      "size": 10682,
      "sha256": "6e199bb549681983a7d8f251e7929f2437d68a204584d0130af41723d01c5293",
      "id": "A-0009"
    },
    {
      "path": "extract/xcheck-001/00-xcheck.bin",
      "kind": "partition",
      "producer": "fwtriage-mcp",
      "is_dir": false,
      "created_at": "2026-10-18T17:39:50.883Z",
      "description": "xcheck @ 0x50000 (65536 bytes) from dumps/flash-full.bin",
      "size": 65536,
      "sha256": "b6f2e962ba93c66ede13e70169701414a72530c57bf0ce4b186d97022dfef230",
      "extra": {
        "offset": 327680,
        "size": 65536,
        "source": "dumps/flash-full.bin",
        "layout_source": "partitions-argument"
      },
      "id": "A-0010"
    },
    {
      "path": "extract/xcheck-001/index.json",
      "kind": "triage-report",
      "producer": "fwtriage-mcp",
      "is_dir": false,
      "created_at": "2026-10-18T17:39:50.890Z",
      "description": "파티션 분할 색인 (extract/xcheck-001)",
      "size": 916,
      "sha256": "c1519e822d02e7218d8086dbb513ff384003494c9d7730083c504df14c84f023",
      "id": "A-0011"
    },
    {
      "path": "analysis/carve-001.json",
      "kind": "triage-report",
      "producer": "fwtriage-mcp",
      "is_dir": false,
      "created_at": "2026-10-18T17:39:50.897Z",
      "description": "fw_carve dumps/flash-full.bin → extract/xcheck-001",
      "size": 1485,
      "sha256": "57da9855894445f668e99b6036baf7c38f069e057992448bd64ce94a9cf3a029",
      "id": "A-0012"
    },
    {
      "path": "analysis/identify-002.json",
      "kind": "triage-report",
      "producer": "fwtriage-mcp",
      "is_dir": false,
      "created_at": "2026-10-18T17:39:51.341Z",
      "description": "fw_identify dumps/flash-full.bin",
      "size": 10682,
      "sha256": "b783605702620bb0b5e59759319dc20ac00ac9e14592fa47c8e8388975ab9b81",
      "id": "A-0013"
    },
    {
      "path": "analysis/entropy-001.json",
      "kind": "triage-report",
      "producer": "fwtriage-mcp",
      "is_dir": false,
      "created_at": "2026-10-18T17:39:51.818Z",
      "description": "fw_entropy dumps/flash-full.bin",
      "size": 5286,
      "sha256": "038a25fccb3bfebf587d2d6562804c044f3e2923f8c2019a30914659c01750ab",
      "id": "A-0014"
    },
    {
      "path": "analysis/uboot-env-001.json",
      "kind": "triage-report",
      "producer": "fwtriage-mcp",
      "is_dir": false,
      "created_at": "2026-10-18T17:39:51.847Z",
      "description": "fw_uboot_env dumps/flash-full.bin",
      "size": 4292,
      "sha256": "14daa5d6d57fee041c1e84d6a290e1e6b3e1fe87d71ea576ee93df662649b774",
      "id": "A-0015"
    },
    {
      "path": "extract/parts-001/00-boot.bin",
      "kind": "partition",
      "producer": "fwtriage-mcp",
      "is_dir": false,
      "created_at": "2026-10-18T17:39:51.875Z",
      "description": "boot @ 0x0 (262144 bytes) from dumps/flash-full.bin",
      "size": 262144,
      "sha256": "af3bdcd6765632e316705fc9ef849942a1824f3948117283aa520f4aea2c1337",
      "extra": {
        "offset": 0,
        "size": 262144,
        "source": "dumps/flash-full.bin",
        "layout_source": "uboot-env@0x40000:bootargs"
      },
      "id": "A-0016"
    },
    {
      "path": "extract/parts-001/01-env.bin",
      "kind": "partition",
      "producer": "fwtriage-mcp",
      "is_dir": false,
      "created_at": "2026-10-18T17:39:51.879Z",
      "description": "env @ 0x40000 (65536 bytes) from dumps/flash-full.bin",
      "size": 65536,
      "sha256": "adc68ad2f3d78fc85369ca25765b6b3cb2eb2906439d7f9ce7f4ba60ab5297d3",
      "extra": {
        "offset": 262144,
        "size": 65536,
        "source": "dumps/flash-full.bin",
        "layout_source": "uboot-env@0x40000:bootargs"
      },
      "id": "A-0017"
    },
    {
      "path": "extract/parts-001/02-kernel.bin",
      "kind": "partition",
      "producer": "fwtriage-mcp",
      "is_dir": false,
      "created_at": "2026-10-18T17:39:51.886Z",